{
  "frames" : [
    {
      "actionId" : "ACT-01-OPENING-SOURCE-BOUNDARY-CROP",
      "frameId" : "CROP-OPENING-001",
      "lines" : [
        {
          "boundingBox" : [
            1.1397058743669832e-09,
            0.7322222220629084,
            0.5125,
            0.05423611111111115
          ],
          "confidence" : 0.5,
          "id" : "OCR-00001",
          "text" : "外卖"
        },
        {
          "boundingBox" : [
            -5.2083327280646094e-11,
            0.6572916664930555,
            0.12083333333333333,
            0.04166666666666674
          ],
          "confidence" : 1,
          "id" : "OCR-00002",
          "text" : "更"
        },
        {
          "boundingBox" : [
            6.36574084309258e-10,
            0.5958333333883101,
            0.22916666666666669,
            0.046875
          ],
          "confidence" : 0.5,
          "id" : "OCR-00003",
          "text" : "清"
        }
      ],
      "sourceFrame" : "crops/opening-source-0.2.jpg",
      "status" : "processed",
      "time" : 0.2
    },
    {
      "actionId" : "ACT-01-OPENING-SOURCE-BOUNDARY-CROP",
      "frameId" : "CROP-OPENING-002",
      "lines" : [
        {
          "boundingBox" : [
            -5.637254692677137e-10,
            0.7322222223784722,
            0.5083333333333334,
            0.05319444444444443
          ],
          "confidence" : 0.5,
          "id" : "OCR-00004",
          "text" : "外卖"
        },
        {
          "boundingBox" : [
            -4.8076932065062767e-11,
            0.6562499998397436,
            0.12083333333333333,
            0.04166666666666663
          ],
          "confidence" : 1,
          "id" : "OCR-00005",
          "text" : "更"
        },
        {
          "boundingBox" : [
            3.515625084876067e-10,
            0.5927083331803384,
            0.22916666666666669,
            0.04895833333333344
          ],
          "confidence" : 0.3,
          "id" : "OCR-00006",
          "text" : "清"
        },
        {
          "boundingBox" : [
            0.5833333316875001,
            0.018749999953124874,
            0.3291666666666666,
            0.034375000000000044
          ],
          "confidence" : 0.3,
          "id" : "OCR-00007",
          "text" : "0: 56"
        }
      ],
      "sourceFrame" : "crops/opening-source-5.7.jpg",
      "status" : "processed",
      "time" : 5.7
    }
  ],
  "generatedAt" : "2026-08-16T02:58:06Z",
  "manifest" : "/Users/hhh0x/self-media/artifacts/creator-research/ai-red-witch/content-reconstruction-v1/videos/69424c0d000000001e039745/skill-run/targeted-evidence/crop-manifest.json",
  "recognitionLanguages" : [
    "zh-Hans",
    "en-US"
  ],
  "schemaVersion" : "ocr-evidence-1.0"
}